	Sentence	Unsupervised Metric	Classification
0	The emphasis of the New Testament is that Christ resisted the temptations thrown at him and it was this that qualified him for dying on the cross .	1.3038193914797362	True
1	Judge William Hannah sentenced him to three months imprisonment suspended for 12 months .	1.3342373633507176	True
2	He mounted the five steps to the front door and rang the bell .	1.3459940107513992	True
3	She was so ashamed of not remembering what had happened that she felt she must compensate him in some way , so she kissed his mouth and stroked his cheek .	1.1137345275037434	True
4	For a long time they thought it might have been dysentery , but thank goodness it did n't turn out to be that serious .	1.7230151575924773	True
5	Of the five other FIS officials accused , one was sentenced to six years ' imprisonment and four to four years each .	1.3529046959373265	True
6	Thank goodness it will be quite different in the country .	1.6884108715148451	True
7	Amid the passionate cauldron generated by 80,000 supporters , who share the ground ( on this occasion Lazio played hosts ) the Romanista — the followers of Roma — were lighting their candles to celebrate a cherished victory .	0.8230441031444475	True
8	And as they planted crops such as barley and wheat , they sowed the seeds of a great Irish brewing tradition .	1.2271317940787003	True
9	He stood up , shrugging his broad shoulders into a thick sheepskin jacket .	2.2726603753835444	True
10	… The whole scene is in fact a kind of shorthand , since the film can not take ten real minutes to show someone smoking a cigarette to the last , which is the more natural behaviour of a worried man trying to think out a problem .	1.0503550315440973	True
11	Athelstan bit his lip , cradling the blackjack in his hands , enjoying its coolness .	1.7341624530962592	True
12	Theda bit her lip .	1.8243256869155302	True
13	""" What is that to me ? "" said the miller , shrugging his shoulders ."	2.2605400969533416	True
14	He rang the bell to her flat .	1.4336747819946738	True
15	The next minute Guido was out of the car and the young woman was in his arms , kissing him on both cheeks , obviously delighted to see him .	1.0711050635936943	True
16	She smoked more cigarettes than anybody I was ever to meet , and she cemented my loyalty to her with frequent presents of Airfix model aeroplanes .	1.0554357194504376	True
17	Thank goodness for sheep , thought the three little piggies as they trotted along in the sunshine .	1.6645628869003088	True
18	Such criticism Thurley argued , very convincingly , never bridges the gap between description and interpretation , which for Thurley involves evaluation .	1.2576511505766839	True
19	The six condemned to death , with another six who were sentenced to life imprisonment , went to the Supreme Court , whose five judges unanimously dismissed their appeals .	1.3635918305660033	True
20	Research Grant ( Project )	1.4568551514315833	True
21	So Julie smiled at us , in a half-proud , half-scared sort of way , that made her look more as if she was going to burst into tears , and marched up the street , pigtails bobbing , and over the main road to the bus-stop , and stood there gazing across at us with blank eyes while the traffic trundled backwards and forwards between us .	1.756950200523426	True
22	Research Grant ( Project )	1.4568551514315833	True
23	Resist the temptation to deposit money in currencies with a high interest rate , or borrow in currencies with a low interest rate , if there is no matching underlying cash flow in that currency .	1.3637028393743658	True
24	Paul Nicholson , harpsichord , is a familiar face in Tilford Church , last seen recently on television as a continuo player with the Choir of 16 in a broadcast from Dublin to celebrate the 200th anniversary of the first performance of Handel 's Messiah .	1.1473890190694407	True
25	Toby pursed his lips as he poured .	2.6369687474013843	True
26	Finally , it is worth mentioning the possibility that the traditional sadness and dejection with which the first crops were cut in Egypt , or the seed was sown in Greece and elsewhere originates in the same unconscious depressive complex .	1.234351568579687	True
27	Research Grant ( Project )	1.337881769709389	True
28	I gritted my teeth and nodded , refusing to be drawn .	2.4703153217474223	True
29	‘ Yes , my lord — beg pardon , Mr Smith !	2.2771713509004337	True
30	He was remanded in custody for a week .	1.6874706676446156	True
31	I beg your pardon , it does look like a Beech bowl does n't it ?	2.2574857089981584	True
32	The French boy pursed his lips suddenly in an expression of disgust .	2.695561042625239	True
33	From there the single line emerged onto the road , and along one side of it the train to West Cork would puff and blow at a brisk but not incautious pace , its smoke staining the leaves of the roadside trees , the guard ringing his bell almost without stop until they were approaching Carrigrohane and could reasonably expect to be out of range of busy pedestrians , excited children , and messenger boys on bicycles plaguing the engine-driver by trying to outspeed him .	1.4131812820471268	True
34	Research Grant ( Project )	1.337881769709389	True
35	Research Grant ( Project )	1.5390556231590242	True
36	‘ You 're a darling , Pogo , ’ Madeleine said , throwing her arms round his neck and kissing his cheek .	1.0512274883137742	True
37	Research Grant ( Personal )	1.3641965240108336	True
38	"In the western Amazonian town of Xapuri , Acre province , a cattle rancher , Darly Alves da Silva , 56 , and his son Darci Alves Pereire , 23 , were sentenced to 19 years ' imprisonment on Dec. 15 for the premeditated murder of Francisco "" Chico "" Mendes Filho , the internationally acclaimed environmentalist and leader of the seringueiros rubber-tappers ' union , who was murdered on Dec. 22 , 1988 [ see p. 36459 ] ."	1.4084433864742192	True
39	That did n't ring their bells either .	1.437294255479098	True
40	His ‘ friend ’ German chancellor Helmut Kohl led the unexpected push at the Edinburgh Summit to make Britain and Denmark ratify the Maastricht Treaty by July .	1.2671383214122112	True
41	’ Thank goodness I 've got through to you at last .	1.6691310878686556	True
42	When the press were allowed to interview the star-spangled jailbird , Mitchum said , ‘ Yes , boys , I was smoking a marijuana cigarette when they came in . ’	1.0815292406391075	True
43	I beg your pardon ?	2.3333054979607177	True
44	I it 's oh it 's a nice noise , I beg your pardon .	2.2730472057279743	True
45	""" Well , I 'm not quite sure that she might n't burst into tears , or perhaps suddenly take all her clothes off "" This had actually once happened to Richard at Nestor and Sage , the investment counsellors where he worked ."	1.7684453235600084	True
46	Becky burst into tears .	1.8212693379341753	True
47	A FURNITURE recycling scheme celebrating its first anniversary has established itself as a lifeline for a town 's needy families .	1.0729434854029096	True
48	she rang it and this bell started going	1.391826680952792	True
49	It is calling for a public education campaign to bridge the gap and help people prepare for caring in advance .	1.222953670547685	True
50	He shuffled his feet and pursed his lips , trying to conceal his embarrassment and surprise at this dangerous , clever English clerk .	2.640752077533496	True
51	Or the Christmas Tree which we light with candles and bedeck with gifts to announce the rebirth of the sun .	0.7583402533574275	True
52	Mandeville bit his lip .	1.8273498539889488	True
53	Research Grant ( Project )	1.337881769709389	True
54	At the time of my infarct I was three stone overweight , smoked 60 cigarettes a day , hated health food ; my idea of a perfect dinner was a plateful of greasy cholesterol .	1.0420745432325649	True
55	She tried to follow and almost fell down the stairs , gritting her teeth to prevent herself passing out .	2.447058112228609	True
56	’ You light the candle . ’	0.814763743032205	True
57	‘ No , thank goodness .	1.7853778343206614	True
58	Billy kissed me on the cheek an' I got all silly an' decided 'e was too forward , ’ she said , not divulging to Annie what happened later , when they were walking home and Billy tried to make love to her .	1.0800484406039037	True
59	That temptation should be resisted .	1.3497887176654408	True
60	‘ I beg your pardon , Miss Marlowe .	2.3145385084977157	True
61	Meredith bit her lip .	1.824201830036241	True
62	‘ Oh , I beg your pardon , Rose .	2.313158327923822	True
63	To ask the Secretary of State for the Home Department whether he will make a statement on the guidelines for the period of imprisonment to be served before prisoners sentenced to life imprisonment will be released on licence .	1.3361471324563208	True
64	I beg your pardon ?	2.3634887530881263	True
65	She bit on her bottom lip as he moved into her roughly , his breath coming faster and changing to a pant .	1.699693121645467	True
66	If it was someone else they 're hardly likely to ring the door bell with Jim standing beside the front door , are they ?	1.355555187256913	True
67	No , no deaths thank goodness .	1.7827647335808008	True
68	ORGANISERS of a service aimed at reuniting lost pets with their owners have just celebrated the group 's first anniversary .	1.0495493650222811	True
69	"Indeed , in 1979 Pat Rogers of the University of Bristol relates the passing of the earlier crisis in English studies to the rise of the new pluralism : "" There is , thank goodness , no great crisis of confidence in English Studies …"	1.6925027935906436	True
70	In a few days time the nation will again pay lip service to the thousands killed in action during the Second World War , while preparing to celebrate the 50th anniversary of the Battle of the Atlantic with a spectacular visit from a NATO fleet in May .	1.1089249194503497	True
71	Intermediate Members may normally enrol on the Professional Diploma Course but may be required to undertake , in the early part of the course , a schedule of bridging studies designed to fill any gaps in their profile of achievement .	1.20677917628415	True
72	4 : Research Grant	1.389558234923392	True
73	She stopped and bit her lip anxiously .	1.794803092163461	True
74	So he 'd ring the bells in other churches as well ?	1.3986307845464672	True
75	Research Grant ( Project )	1.337881769709389	True
76	Peter Turton , 28 , was further remanded in custody by Bootle magistrates today charged with murdering his mother in Crosby .	1.6951874441705872	True
77	Christina flung her arms around him and kissed him on the cheek .	1.0887850976577471	True
78	He gave her food to eat , and watched her , while he quietly smoked a cigarette .	1.032055229251208	True
79	On the Monday and the Tuesday he came to the front of the house and rang the hall door bell .	1.3267885188588302	True
80	We speak of the ‘ sacrifices ’ we make for one another — that notion rings many bells .	1.3974435235040612	True
81	Backing has also come from the Strathfoyle Community Association , which has just celebrated its 20th anniversary .	1.0459385902749596	True
82	Lightly shrug both shoulders , bringing them up to your ears , then dropping them down .	2.241158014911371	True
83	One morning a letter arrived from my literary agent , Michael Sissons , enclosing a handwritten manuscript of some 100,000 words written by a prisoner named David Cooper who , ten years earlier , had been sentenced to life imprisonment for his part in the Luton murder .	1.383627537419738	True
84	Lord Henry Wotton lay back in his chair and smoked his cigarette .	1.0593340017279365	True
85	And when she tried to interest him in niente acqua , he laughed as he limped round his shelves serving several customers at once and , shrugging his high shoulders , said , ‘ Non c'è pioggia , non c'è acqua . ’	2.262111353341027	True
86	Research Grant ( Project )	1.337881769709389	True
87	Merry pursed her lips in a silent whistle .	2.650440911509682	True
88	Members of Congress and administration officials ought , in theory , to be wringing their hands this week ; most are shrugging their shoulders .	2.246343032564732	True
89	‘ Thanks , ’ he grinned , then leant over and kissed her on the cheek .	1.0669573311132143	True
90	Rogers leaned forward and licked his lips .	1.8469730348185154	True
91	4 : Research Grant	1.389558234923392	True
92	Now the seeds had been sown .	1.3532512723683956	True
93	I says I beg your pardon ?	2.302633509396479	True
94	Yes , wind them round and this should , should generate a charge which rang bells and sounded bells and then er you lift up a telephone and plug in a jack and , and take a message in that way .	1.383659424543326	True
95	‘ When we reached our houses , Lily kissed my cheek and ran in .	1.0949851837018763	True
96	Having done a railway trip together to the West Somerset Railway to celebrate our Silver Wedding anniversary , at a time when we could n't have a party , my wife and I recently held a belated one at the Gwili Railway , ably assisted by family , friends and some members of the BCRS committee .	1.0915760572633213	True
97	I shrugged my shoulders and then the hospital came on the line .	2.281663225899915	True
98	Everybody was smoking the way they did when cigarettes were glamorous .	1.1639949546822264	True
99	He was remanded in custody in Nottingham .	1.7017415298258607	True
100	An army camp that was set up to support the Normandy landings and has become the lynchpin of the British Army is celebrating its fiftieth anniversary .	1.0985130823212401	True
101	She recently celebrated her first anniversary as Cleveland 's only agony aunt for pets .	1.022931655640019	True
102	rings a bell	1.4369840274170955	True
103	‘ All right , ’ Finlayson said easily , licking the drops off his upper lip .	1.8077682744501664	True
104	Lee shrugged his shoulders .	2.3828470005964526	True
105	A senior British source said yesterday : ‘ If the Irish find they can not ratify the Maastricht treaty there is n't going to be a treaty . ’	1.293919749933021	True
106	He kissed her cheek .	1.1656721987831338	True
107	Lamb and Canning were both remanded in custody for one week .	1.758006179335184	True
108	At last he was freed , and gritting his teeth , Jack took the small forearm firmly in his hands and lifted it quickly off the last spike .	2.4379712467387957	True
109	On June 30 , 1989 , former British Army corporal Dennis Beahan was sentenced to life imprisonment for his part in an abortive attempt to free five Zimbabwean saboteurs ( including the above three ) from prison in June 1988 .	1.3793333336941773	True
110	Sitting between the driver and the sergeant , she gritted her teeth as her bones were pounded by every pothole in Port-au-Prince .	2.440534045193741	True
111	He shrugged the shirt from his broad shoulders and threw it casually on to a chair .	2.316571977823012	True
112	‘ I do , ’ Rory said , biting his lip and looking down at his glass .	1.7358313931822134	True
113	In the absence of other worm supplies it may be hard to resist the temptation of feeding tubifex , particularly if one has not yet had any casualties following feeding .	1.2930305085132454	True
114	Research Grant ( Project )	1.337881769709389	True
115	There the higher number of offenders sentenced to imprisonment , augmented by a burgeoning population of unconvicted persons remanded in custody awaiting trial , regularly exceeded the capacity of the prison system to contain them in acceptable conditions .	1.606870166298313	True
116	THE ANNIVERSARY of a Darlington landmark might still be celebrated despite fears it would go unnoticed .	1.0759457615134826	True
117	He began to kiss her cheek , her ear , her throat , and his words were whispered against her tingling skin .	1.029675812650962	True
118	‘ I beg your pardon .	2.360368475461632	True
119	The clanging from the blacksmith 's rang like a bell through the air ; somewhere a child cried , the son or daughter of one of the garrison .	1.3348601347749842	True
120	Er I , I was a messenger for a time for the er , we lived in Lane and I was a messenger for a time with the erm A R P headquarters in Drive , now when my uncle got married and he had two children and I 'd , they were issuing gas masks and I had to go down and fetch a gas mask for his daughter and they were great big ones that used to envelope the whole babies with a bellows on the side that the mothers used to have to pump when they were in them , thank goodness we never had to use them and erm	1.765376787372755	True
121	Research Grant ( Project )	1.4568551514315833	True
122	A CROWN Prosecution Service solicitor was sentenced to life imprisonment yesterday for murdering his wife , a student nurse , with a hammer .	1.339074748698799	True
123	R A F Benson in Oxfordshire celebrates its 50th anniversary this week .	1.0847695154103532	True
124	Research Grant ( Project )	1.337881769709389	True
125	Bridging the Pragmademic Gap	1.322271790726543	True
126	Oh I beg your pardon	2.326291939390443	True
127	Well we were gon na go to the pub and celebrate my three year anniversary of suffering this department .	1.053956329960623	True
128	‘ I saw the skeletons and — ’ To his surprise , he had to stop , in case he burst into tears .	1.7491513298508972	True
129	He was subsequently sentenced to two years imprisonment .	1.406164149351374	True
130	‘ I beg your pardon ? ’	2.350129670404557	True
131	Research Grant ( Project )	1.5390556231590242	True
132	Linda Kelly , 44 , of Alston Avenue , Cramlington , was remanded in custody by Blyth magistrates at the weekend charged with murdering her husband , Michael , at their home last Friday .	1.6357595379827636	True
133	Research Grant ( Project )	1.337881769709389	True
134	She gritted her teeth .	2.480096659662445	True
135	As he was waiting for the barmaid to pour the drinks , Dexter could not resist temptation .	1.2593704945539888	True
136	‘ I beg your pardon ? ’	2.350129670404557	True
137	One kiss — a seed is sown ,	1.3025419152345115	True
138	"He paused , bit his lip lightly for a second , "" But I do n't know what you 're doing ."	1.716596084138307	True
139	Research Grant ( Project )	1.337881769709389	True
140	Resist the temptation to climb onto the ledge , for this is one of those red herrings which prove difficult to retreat from , and make haste with the short traverse , after which a few moves on rounded layaways gain the surprisingly airy belay .	1.3007115952044874	True
141	He was remanded in custody to appear at Crumlin Road court on September 17 .	1.6993415259856894	True
142	She belted her raincoat firmly and pursed her lips .	2.6134649697813734	True
143	Fighting a fearful urge to burst into tears , Daisy giggled instead .	1.7597320928181681	True
144	The editing problem is that this particular group of shots ends with the boat 's abrupt departure — we go suddenly from shots of the men at work to one in which the boat is already in motion : in effect , we have a jump-cut , and your task as editor is to find some way of bridging the gap in the action .	1.271751773569164	True
145	— David Clark , 21 , of Station Road , Darlington , was remanded in custody for a week when he appeared before Darlington magistrates yesterday charged with causing grievous bodily harm to Michael Gibson .	1.6310165748822043	True
146	The tenth anniversary of the civil rights movement was celebrated on 1 January 1979 amidst a growing alienation of the minority Catholic population , a rising toll not only of violence but also of poverty and unemployment in the six counties , and an increasingly unbridgeable gulf within the majority Protestant ranks , with the Official Unionists and the so-called Democratic Unionists under the Revd Ian Paisley vying with one another in intransigence and extremism .	1.1106027471693105	True
147	"She bursts into tears of pride at the very mention . """	1.784812989916555	True
148	I 'd thought it was Dargaville but when we reached the small town of Warkworth , the name ‘ rang a bell ’ .	1.3841042307680966	True
149	George sat on his haunches , biting his lip inside the mask .	1.7537371110874655	True
150	She removed the wrapping from her supper , then stopped , biting her lip thoughtfully , tempted to lead Luke on a little , to let him worry .	1.6812009588405294	True
151	Mr. Butler was sentenced to eight months ' imprisonment .	1.431495334203462	True
152	‘ I beg your pardon ? ’ said Dolly haughtily .	2.3027910997413885	True
153	Research Grant ( Project )	1.337881769709389	True
154	If , over the last five years X/Open has been providing specifications for ‘ open systems plumbing , ’ bridging the gap between vendor products and user requirements , the introduction of XPG4 , X/Open hopes , will see it re-cast as a ‘ standards integrator . ’	1.299426985447624	True
155	Rex bit his lip .	1.783577362996917	True
156	Thank goodness they 're not looking for me , he thought as he crossed the room .	1.654535016205252	True
157	Would Mr Lawson then have resisted the temptation to trundle round his Cabinet colleagues , showing off his muscles and boasting that he alone had faced up to the Iron Lady and won ?	1.304825478596709	True
158	James Thear , 28 , of Aspley Gardens , Kenton , Newcastle , was remanded in custody by Newcastle Crown Court yesterday on firearms charges following a siege in Little Benton last December .	1.6646837114596889	True
159	She bit her lip and turned away from the older nurse .	1.7579441897416317	True
160	We will not cheat health authorities by agreeing pay awards which are not fully funded and leaving managers to bridge the gap by cutting patient care .	1.2540959363731161	True
161	You do n't need to ring the bell .	1.4035982023816282	True
162	Research Grant ( Project )	1.337881769709389	True
163	His lips were pursed , as if with impatience .	2.673801603073691	True
164	Bonard bit his lip and turned his gaze once more to the horizon .	1.7498958396519853	True
165	Having failed to persuade Mr Shankly to change his mind , Liverpool 's board resisted the temptation to appoint another charismatic manager .	1.27770509848443	True
166	The two-plus-four treaty had been ratified by Germany and the United States in October 1990 [ see p. 37762 ] , by the United Kingdom in November [ see p. 37867 ] and by France on Dec. 13 .	1.287801452657852	True
167	He turned his head and glanced to where Martin was taking off his overcoat , and Martin raised his eyebrows , pursed his lips and nodded his head , the action saying , ‘ You 're in for it again , laddie . ’	2.6817871317779085	True
168	Woolley pursed his thin lips and addressed Rogers and Kimberley in particular .	2.6422029351099376	True
169	The other shrugged his shoulders .	2.3457127090009107	True
170	Look , British Library Chambers I beg your pardon .	2.2872934140731926	True
171	She bursting into tears and ran off home !	1.741284667982772	True
172	We rang the bell which made musical chimes , and the admiral answered it .	1.3556405771311468	True
173	Historians must therefore bridge these gaps by intelligent and imaginative thinking .	1.2632648611816288	True
174	Today they were each sentenced to four years imprisonment .	1.4017320004458687	True
175	He would return to her , to beg her pardon for so basely misjudging her , and they would find again the former ease of friendship , the lack of which now gaped in her life like an open wound .	2.2225390047609	True
176	Standing on tiptoe , she kissed him on the cheek .	1.1873433816464194	True
177	A FOUNDING member of the Royal Air Force from Essex will today be meeting the Queen to celebrate the service 's 75th anniversary .	1.0480772334003476	True
178	Beg your pardon ?	2.3460396402688115	True
179	Nanette shrugged her shoulders .	2.3528759399274075	True
180	‘ I beg your pardon ! ’	2.347473161047526	True
181	Over 1,480 guests came from around the world to celebrate the 50th Anniversary of the Battle .	1.120825765487572	True
182	Having told her story with some brio , Miss Breeze burst into tears and was comforted by the motherly Miss Maitland .	1.7517422802990994	True
183	The woman was remanded in custody until Friday .	1.7566291105327454	True
184	‘ I beg your pardon .	2.3299633859476705	True
185	‘ We arrived at 10.55 and rang the bell .	1.380244754020309	True
186	They can resist temptation long enough to make decisions based on good sense .	1.2596923807809326	True
187	Birkett shrugged his shoulders and went on with the fish cakes .	2.301488378070399	True
188	He soon switched his attention to bridging the 100-mile gap between the Franco-Belgian telegraph wire which ended at Brussels and the German one at Aachen .	1.2476207326057633	True
189	‘ I think the name rings a bell . ’ ’	1.4223163266441938	True
190	Research Grant ( Project )	1.337881769709389	True
191	Research Grant ( Project )	1.337881769709389	True
192	Leach was remanded in custody until Friday .	1.7715931546381631	True
193	Glaring at Luke , she burst into tears .	1.782136520185813	True
194	Joseph Slatter was remanded in police custody .	1.814307305161396	True
195	Knocker shrugged his massive shoulders with look of resignation on his face .	2.284834771681988	True
196	Resist that temptation by turning it on its head .	1.298098017914266	True
197	William Tanner walked into the flat with Danny following behind him and both men bent over in turn to kiss Carrie on the cheek .	1.1068313534777023	True
198	Frank replies , ‘ I beg your pardon ? ’ 'The funny beret and the Humphrey Bogart raincoat . ’	2.273718204435919	True
199	sorry I saw it yes I beg your pardon , I 'm sorry	2.2612211620495435	True
200	The Grain Terminal celebrates its 10 year anniversary	1.143483075945198	True
