	Sentence	Unsupervised Metric	Classification
1298	‘ Thank goodness , he 's gone . ’	1.6909364729468745	True
1299	Research Grant ( Personal )	1.3641965240108336	True
1300	A great log fire crackled in the hearth , the room was lit by squat wax candles fixed on metal spigots around the walls and , at the far end , under the oriel window , was the dais and high table .	0.7166168648289182	True
1301	‘ I beg pardon , sir ?	2.3033962638738097	True
1302	The anniversary was to be celebrated with a torchlit procession , military parade and fireworks .	1.0801197573803525	True
1303	Andy shouts , and I think he 's going to burst into tears like me .	1.7454758768174126	True
1304	Minna purses her lips .	2.685893257650199	True
1305	Newshounds bridge the gap	1.2618390176373484	True
1306	Does that ring any bells ?	1.4420613312447905	True
1307	She had a sudden unnerving vision of those long fingers moving as gently over her flesh , and bit her lip again on a shiver of awareness .	1.6774758022323313	True
1308	Yesterday Colin Griffiths from London was charged with his murder and was remanded in custody for a month .	1.6896491346300357	True
1309	I remembered times when I rang the bell and there had been no answer .	1.410774353838334	True
1310	Er , so you have to resist that temptation .	1.3167487706605363	True
1311	Robyn pursed her lips angrily .	2.669609135911384	True
1312	Claudia bit her lip had .	1.8211216237335	True
1313	Research Grant ( Project )	1.4568551514315833	True
1314	I beg your pardon .	2.332577980019027	True
1315	She put her hands over her face and burst into tears , scurrying towards the door .	1.7322111970745326	True
1316	4 : Research Grant	1.389558234923392	True
1317	Together , Perry and Crilly committed endearing and devilish acts ; climbing to the ceiling of the asylum chapel to ring the chapel bell at precisely the wrong time , loitering upon the roof of the geriatric ward in pursuit of fat blue-winged pigeons , throwing craps in front of the Sinn Fein bookshop .	1.3439141287331922	True
1318	In this case , the addresser , the message sender , has made unwarranted assumptions about the extent to which the same schematic knowledge is shared by the receiver , and leaves too many gaps , or gaps too broad to be bridged .	1.1639849239336466	True
1319	She bit her lip as her own words flung themselves back in her face .	1.6620013715437736	True
1320	The new chief executive of Batsford , which celebrates its 150th anniversary this year , is another shareholder , Bobby Cox , who has been running Seaby , a specialist coin company with historical associations with Batsford .	1.1316561514542336	True
1321	Suddenly , he shrugged his strong shoulders , before deliberately turning his back on her and strolling from the room .	2.2532346835621313	True
1322	( Thank goodness for magazines that cater for all tastes . )	1.6816731850756512	True
1323	Janet , 30 , burst into tears and blurted out ‘ I will ’ as fellow passengers applauded and flocked to buy her champagne .	1.7408156999676883	True
1324	Pale grey summer suit , ready-made but a perfect fit ; neat hair already beginning to match the suit ; and , what pleases me most , this trim matching beard to bridge most of the gap between suit and hair .	1.3282973007709917	True
1325	‘ Thank goodness for the Parisian inspectors .	1.6971215830516018	True
1326	Thank goodness for that , they did n't get it .	1.679287413604186	True
1327	— O the Pleasure of counting melancholly Clock by a snoring Husband ! — But now , Sister , you shall see how handsomely , being a well-bred Man , he will beg my Pardon .	2.221700776885472	True
1328	O'Connor consumed by emotion , burst into tears in front of thousands of delirious supporters when he consolidated his marvellous recovery against Freddie Couples with a No. 2 iron to five feet at the last .	1.7171025165194578	True
1329	In fact in the eighteen nineties , I believe the seeds were being sown , of what has since been called the time obsession of the twentieth century .	1.2521360796581984	True
1330	The bee had got into a sandwich , and bit him on the lip when he began to eat .	1.6458799094193155	True
1331	The words came out without thinking , and Folly bit her lip .	1.763511845778978	True
1332	Research Grant ( Project )	1.5390556231590242	True
1333	The house had been designed for a family with servants , and in the pantry there was an indicator board that showed which room the bell had been rung from .	1.3766835829018595	True
1334	Irene bit her lip .	1.7373542066255716	True
1335	‘ Begging your pardon , Mr Josh , sir . ’	2.2865385668256857	True
1336	However , in such studies , pipe and cigar smokers were usually defined as those who had never smoked cigarettes : these primary smokers tend not to inhale and so are exposed to relatively low amounts of tar and other harmful constituents of the tobacco smoke compared with cigarette smokers .	1.0088400333260905	True
1337	He shrugged his shoulders .	2.3334530889056775	True
1338	Research Grant ( Project )	1.337881769709389	True
1339	The Captain smoked imported Marlboro cigarettes .	1.155375696137591	True
1340	a certain part of I beg your pardon sorry I 'm getting my definitions wrong may be looking after something which the erm corporate locations are solely within the south but it 's handled by an corporate account .	2.2706749235420665	True
1341	Judge Tony Briggs sentenced Cocker to 12 months imprisonment suspended for 12 months and Wild to nine months imprisonment suspended for 12 months .	1.30360858387242	True
1342	Research Grant ( Project )	1.337881769709389	True
1343	A fun weekend is planned to celebrate the 10th anniversary of the opening of Ferryhill Leisure Centre .	1.0616530856259407	True
1344	Prolonged passive smoking can lead to an increased risk of lung cancer for people WHO HAVE NEVER SMOKED A CIGARETTE IN THEIR LIVES .	1.0380813468151828	True
1345	She bit her lip .	1.8188305870709796	True
1346	Beg your pardon ?	2.3460396402688115	True
1347	She and her brother went to see him and he was so touched by her gesture that he burst into tears .	1.7537596143803167	True
1348	Robyn bit her lip , hesitating .	1.8057386227289274	True
1349	‘ Until then waves had looked like a pleasant photogenic distraction on television , and not a serious challenge to anything else , ’ Salter recalled , ‘ but getting so close to 5 p/kWh would have rung a lot of alarm bells with people who would feel threatened . ’	1.346731940834657	True
1350	He received the award during a gala dinner in Buenos Aires held to celebrate the 100th anniversary of the Argentine Football Association .	1.0969397651629944	True
1351	I beg your pardon ?	2.3634887530881263	True
1352	Research Grant ( Project )	1.337881769709389	True
1353	"Instead , try : "" Thank goodness you 've brought that ."	1.6732555643300242	True
1354	‘ I hope some of these names mean something to you ; they do n't ring any bells with me . ’	1.4285474405377883	True
1355	Expectation gap can be bridged	1.2804455851089724	True
1356	Just grit your teeth and get things straight .	2.503379323272822	True
1357	Right , my friends we 've very strange and wonderful chemicals in this erm I do beg your pardon when we are printing .	2.2503036793759557	True
1358	Thank goodness for Rainbow 's lousy housekeeping .	1.694640348378846	True
1359	Daphne Parish , a British nurse sentenced to 15 years ' imprisonment by an Iraqi military court on March 10 [ see p. 37332 ] , was unexpectedly freed on July 16 .	1.3749899814417046	True
1360	In May and June 1713 various trading and manufacturing groups throughout the country — cloth merchants , woollen and silk weavers , distillers , and gold and silver wire-drawers — petitioned Parliament against the legislation needed to ratify the commercial clauses of the Treaty .	1.2880739149665397	True
1361	In December 1983 he was sentenced to 10 years ' imprisonment for ‘ opposing the revolution ’ .	1.3531322708154865	True
1362	‘ I beg your pardon , but who are you ? ’	2.287598518289464	True
1363	The police officer burst into a flood of tears .	1.8411814295532172	True
1364	‘ Unknown , ’ replied the Bookman shrugging his shoulders .	2.3041961987991586	True
1365	I said , I beg your pardon ?	2.2905997857334497	True
1366	‘ When I told him , his reply was that he thought I had liked going there , and he burst out with , ‘ Thank goodness you told me .	1.6433423171602188	True
1367	Of course , the servants ' hall at Darlington Hall , like any servants ' hall anywhere , was obliged to receive employees of varying degrees of intellect and perception , and I recall many a time having to bite my lip while some employee — and at times , I regret to say , members of my own staff — excitedly eulogized the likes of , say , Mr Jack Neighbours .	1.7474605941266228	True
1368	Maggie was stabbing her finger at the different plates on the table , and her aunt wagged her head and pursed her lips before she said , flatly , ‘ I 'm courting one of the airmen ; he comes to Donald 's farm . ’	2.6768789599535774	True
1369	The St Albans clock had two similar escapements , one to control the going-train and one to ring the bell each hour on a twenty-four-hour system with the number of strokes equal to the hour .	1.389486092625734	True
1370	She quickly rang the bell , not knowing what to think or to feel .	1.3801793412294447	True
1371	This problem has been so bad that the company has returned to temporarily producing its old-style model to bridge the gap .	1.2003031186248754	True
1372	Mrs Friar pursed her lips into their accustomed position .	2.662039892180612	True
1373	She felt oddly cold and sick but bit her lip staunchly and gathered their cases together .	1.7442043679955102	True
1374	The cigarettes were smoked properly with each being inhaled as much as possible .	1.0347064722250965	True
1375	She bit her lip .	1.8188305870709796	True
1376	A MAN accused of murdering Essex supermarket worker Barry Bradford has been remanded in custody .	1.7076728781606438	True
1377	THIS year the Tilford Bach Society celebrates their 40th anniversary , no mean achievement when music societies throughout the country are faced with increases costs and massive competition from alternative forms of entertainment .	1.0903161221160629	True
1378	Through the silence rang a bell as if signalling the end of a round in a boxing match .	1.3334799625487521	True
1379	[ to PAMELA ] Own that you have been very saucy and beg my pardon and I will try to pity you , for you are a sweet girl if you had but held out and been honest .	2.1948730059999644	True
1380	4 : Research Grant	1.5985277970323317	True
1381	Research Grant ( Personal )	1.4680086634092055	True
1382	Melissa bit her lip at the thought of the ordeal facing Antoinette Gebrec and wondered who , if anyone , would be there to give comfort and support .	1.7042509500920555	True
1383	Again she rang the bell , impatiently this time , and the nun who appeared was contrite , saying , ‘ I 'm sorry , Reverend Mother ; I …	1.4299076936956405	True
1384	Peter O'Dwyer , 23 , of Arthur Street , Darlington , was remanded in custody charged jointly with others of burglary at The Gatehouse , Ellerton-on-Swale , near Catterick , when electrical equipment and other goods worth £1,200 were stolen .	1.6587048997878495	True
1385	""" Not one of them has been stolen since the seed was sown ."	1.272256320507195	True
1386	4 : Research Grant	1.389558234923392	True
1387	If that sounds feeble by comparison with ‘ normal ’ American recoveries , then thank goodness .	1.7313758121005682	True
1388	The result of this preponderance of the ideological in the literary debate was that discussion tended to centre exclusively on recurrent programmatic themes — positive heroes , revolutionary romanticism , partisanship , tendentiousness , and so on — in which were sown the seeds of a sterile , bureaucratic and immobile aesthetic theory unable to adapt to changing socio-political conditions , capable only of mouthing the current party line .	1.3265149138842316	True
1389	Benedicta bit her lower lip to stifle her laughter .	1.7059844797584978	True
1390	His brother , Mohammed Ali Hamadei , had been sentenced to life imprisonment in Germany in May 1989 for his role in the hijacking of a United States Trans World Airlines aircraft in 1985 [ see p. 36666 ] .	1.3901766342090154	True
1391	To help bridge the gap , in February a congressional commission recommended broader access to the tax-exempt market for infrastructure projects involving some private control .	1.2079506582253696	True
1392	He was leaning against the rail smoking a cigarette and staring with an air of melancholy towards the distant island .	1.0438519158485116	True
1393	‘ I do n't believe people here smoke 125% more cigarettes and in fact two in 10 people who contract lung cancer do not smoke .	1.0510377011561254	True
1394	You can not expect her to agree wholeheartedly with everything connected with the way you run your home and raise your family , but you must not tolerate any interference in matters that are your concern -just as you must resist the temptation to try to tell her how she should run any part of her life .	1.32586213961506	True
1395	Mrs Stych licked her lips .	1.866005590336814	True
1396	He and his wife Beryl discovered churchgoers had gathered to see the two plant a beech tree to celebrate the vicar 's anniversary which falls on Easter Sunday .	1.029013113683412	True
1397	Anderson was remanded in custody to appear at Crumlin Road Courthouse on June 11 .	1.701815813914531	True
1398	I lit the candle inside the skull of Old Saul .	0.7720490374634223	True
1399	She bit her lip , but the words escaped her anyhow .	1.6777844641619883	True
1400	The greatest mistake was the conflict of lights — the windows not having been darkened , though countless thousands of wax candles were lighted .	0.7207254490482382	True
1401	Mr Lamb said : ‘ The council has put nothing in the budget to celebrate the anniversary yet Bowes Museum at Barnard Castle has just got £100,000 from the county council to mark its centenary .	1.1534649391213403	True
1402	He was sitting on a sofa outside the lecture-room , smoking a cigarette .	1.0615416892191771	True
1403	‘ I beg your pardon , ma'am ? ’	2.3246697461630355	True
1404	Then she started running wildly through the streets , and when she was exhausted she stopped and burst into tears .	1.6979170347064916	True
1405	The UK government welcomed the release and expressed the hope that it would be followed by the release of a British businessman , Ian Richter ) , sentenced to life imprisonment on bribery and economic charges in 1986 .	1.3866027180443268	True
1406	Thousands of boys and young men , pale , narrow-chested , hunched-up , miserable specimens , smoking endless cigarettes , numbers of them betting , all of them learning to be hysterical as they groan and cheer in panic unison with their neighbours — the worst sound of all being the hysterical scream of laughter that greets any little trip or fall of a player .	1.0370217452879409	True
1407	In the nearest modern marketing has come to the skin-flintery of Ebenezer Scrooge , a growing number of American shopping malls have picked the Christmas season to ban the Salvation Army from ringing its bells and asking for money for its traditional Big Red Kettle collection boxes .	1.3855979447398528	True
1408	‘ Thank goodness ! ’ he said .	1.7736975697805115	True
1409	""" Thank goodness , I 'm not having a heart attack "" was my reaction ."	1.7312019741215268	True
1410	They ring at the bell , hear me scuffling in the hall : one , two , and I die on the carpet .	1.3721107590584922	True
1411	The drafter should therefore resist the temptation to make the terms too one-sided or restrictive .	1.2682011511053033	True
1412	Together with a woman , Sonam Choedron , ( who was released in April 1991 ) they were tried on 8 February 1991 and reportedly sentenced to four years ' imprisonment .	1.3785526690661278	True
1413	I do n't want to ring the bell on myself and go back into the classroom just yet . ’	1.4109881186112778	True
1414	Proof of this may be demonstrated by the relative lack of pleasure when smoking a cigarette with one 's eyes shut .	1.036580377585767	True
1415	Research Grant ( Project )	1.337881769709389	True
1416	Research Grant ( Project )	1.5390556231590242	True
1417	( Resist the temptation to post it .	1.3286448802880684	True
1418	Then we lit the candles and read the Visitors ' Book through from 1960 onwards .	0.7787932122537801	True
1419	She bit her lip , the dark eyes suddenly very bright .	1.6877873945344852	True
1420	Paige bit her lip .	1.7365648301794914	True
1421	He shrugged his shoulders .	2.341242881259512	True
1422	Research Grant ( Project )	1.4568551514315833	True
1423	Research Grant ( Project )	1.5390556231590242	True
1424	Julie , who taught at a local school in a notoriously rough , tough area of the city , shrugged her shoulders .	2.296239717276488	True
1425	Thank goodness for nursing !	1.7834380963372436	True
1426	She licked her lips and looked once more at Cleo .	1.8976278144119032	True
1427	I was gritting my teeth , thinking , ‘ Thank god we 're going down the 18th . ’	2.4482616977093348	True
1428	In January 1991 Hong Song-dam was sentenced to three years ' imprisonment for producing material benefiting North Korea .	1.3969150396031205	True
1429	‘ Oh baby , ’ she said , and kissed my cheek .	1.0793418998437665	True
1430	When he appeared before the magistrate at lowly Clerkenwell , charged with ‘ willfully ringing several door bells and knocking at the doors in Upper Street , Islington , without lawful excuse ’ it was said that this kind of mischief — like the Cremorne Gardens affray — was a ‘ frequent occurrence ’ .	1.4284799149818619	True
1431	She barged past police , threw her arms around Diana 's neck and kissed her on the cheek .	1.0602773291461844	True
1432	She licked her lips .	1.8667929057951946	True
1433	Ross shrugged his broad shoulders .	2.3696892502980185	True
1434	In these circumstances he is considered to have developed a model which does not bridge the gap between reality and his aspirations .	1.2342875508097226	True
1435	The US Senate voted on Nov. 25 to ratify the CFE treaty , and it also approved , by 86 votes to eight , the allocation of $500,000,000 from the US defence budget to help finance the destruction of tactical nuclear weapons in the Soviet Union , as proposed on Oct. 5 by President Mikhail Gorbachev [ see p. 38553 ] .	1.234349986372539	True
1436	And as the Saatchi shares peaked ahead of the 1987 stock market crash the seeds of its financial decline had already been sown .	1.2651276400283944	True
1437	The patient first attended the Royal Liverpool University Hospital in 1985 when she was 21 years old , worked as a clerk , and smoked eight cigarettes per day .	1.0757084920026647	True
1438	And water being a conductor , the charge might just possibly have bridged the gap by this means .	1.2140209705246467	True
1439	Somehow it rings a bell .	1.4200062808613487	True
1440	‘ I can never resist the temptation to épater , ’ he confesses .	1.3154648078191622	True
1441	She pursed her lips and rubbed a hand over her thick brown hair .	2.6106382165807003	True
1442	Gritting his teeth , he fought it down .	2.4673128961614985	True
1443	right so it 's for the half year sorry , beg your pardon five million half year	2.260960929301071	True
1444	Riley pulled an ear and bit a lip and said this was all very well but the trouble was he had learned the other man was unwilling to move to the Post after all .	1.7122652903026732	True
1445	But how I longed to be gallant , as they say ; to ask her if I might kiss her on both cheeks if I gave her my two violets .	1.1028936728356618	True
1446	bom , bom , right , cos I 'm inclined to do that sometimes , right , you know you 've got to sow seeds with customers that 's where you get your recommends from , right , eh , you know that you put it , show a warmness towards you , you follow me ?	1.2688160928755472	True
1447	4 : Research Grant	1.497560522991701	True
1448	‘ I beg your pardon , ladies !	2.327514724900524	True
1449	In the Incident Room DC Curnow was duty officer and Kersey , smoking his third cigarette of the morning , brooded over a stack of reports .	1.0302881619218427	True
1450	But he sentenced them to life imprisonment .	1.444310207969464	True
1451	On Monday the Foreign Secretary , Douglas Hurd , said that the treaty would be ratified whether or not the Commons passed the amendment .	1.2818059591107367	True
1452	4 : Research Grant	1.389558234923392	True
1453	He then went to the special candle stand in the centre of the Grotto and lit his candle .	0.7573335397519338	True
1454	He licked his lips and looked at Bodo who , grim-faced , shrugged .	1.8116684660580327	True
1455	Alyssia bit her lip until she felt a trickle of blood on her mouth .	1.7227460869498696	True
1456	Assurances that a new era was underway were made at a civic banquet to celebrate the thirty-fifth anniversary of the People 's Republic .	1.0470748153496268	True
1457	But actually there is one important thing they can do which would certainly improve world economic prospects : resist the temptation to put up new protectionist barriers , and push ahead with a speedy conclusion of the Uruguay round of trade talks .	1.2969702016933513	True
1458	Cartwright was remanded in custody for seven days .	1.6944530743656299	True
1459	Research Grant ( Project )	1.5390556231590242	True
1460	To my amazement he covered his face with his hands and burst into tears .	1.7630618284842812	True
1461	The Spirit urged Jesus into the desert , where he resisted the temptations of the Devil , who did not seem to know that he was tempting God himself .	1.288054343292558	True
1462	A Barn Dance to celebrate the Society 's 35th Anniversary will be held on 4th July 1987 at .	1.065862865528316	True
1463	Alarmed , she swung around and lit the candle .	0.7965742985548914	True
1464	I said ‘ good night ’ and kissed him on his cheek but he did n't respond .	1.1511350695638245	True
1465	The three were remanded in custody .	1.7844684981844015	True
1466	Allowing for the inevitable delays of London traffic I rang the bell of her flat at six-thirty .	1.3746972405669102	True
1467	Her face flushed and she bit her lip .	1.6856976057522428	True
1468	Susan did n't reply — just shrugged her shoulders .	2.2949805514021913	True
1469	She licked the salty tears from her lips and , taking a tissue from the box by the bed , blew her nose loudly .	1.7670335325474222	True
1470	‘ I beg your pardon , sir .	2.326564142153686	True
1471	She stood poised for a moment , stretched her mouth wide , licked her lips , moved her shoulders from side to side , then let her body sway , waited for the chorus to finish and the verse to start and she went on .	1.8551830119171742	True
1472	Dirkin licks his lips .	1.969804755804672	True
1473	The shift in Feargal 's body brought awareness which Ellie determinedly ignored — brought warmth , and she gritted her teeth to deny it .	2.4285662159545383	True
1474	4 : Research Grant	1.389558234923392	True
1475	She would grit her teeth and take everything he threw at her — for the time being .	2.4333866725895796	True
1476	Kate shrugged her shoulders .	2.3508821536600037	True
1477	And if he had rung the bell at Connon 's what reason would he have had to kill Mary ?	1.3873809325747488	True
1478	However small it was ( and whether it is just or not ) , I have felt over the years that the Halton experience has enabled me ( despite my background ) to bridge the gap between those far off days , and reaching the rank of sergeant pilot , and the mid-war years when , in a few months , there was swift passage through the roles of flight commander , squadron commander , staff officer and station commander .	1.3203742009305302	True
1479	Erm , dum , dum , the market stall as you know , we did n't have it in the market , we had it on the thank goodness because we parked it in the shade , erm during that period we got five hundred and thirty two signatures , with three or four more of you it could of been a thousand , erm we also got fourteen pounds , seventeen in donations , all completely unasked for cos as you know , we do n't take money .	1.716558274966847	True
1480	Then he burst into tears .	1.810282093059223	True
1481	Research Grant ( Project )	1.5390556231590242	True
1482	Shiona bit her lip .	1.778769271629536	True
1483	Carol 's face fell and I thought she might burst into tears .	1.7790339817902359	True
1484	Ambulance , thank goodness someone 's remembered , patting this person 's hand , and putting blankets on and reassuring them , telling them everything 's alright , and blood all over the floor , thank god someone 's gone to get the ambulance	1.643307217702118	True
1485	So the very thing that was supposed to wake them up , the noise of the alarm bell , was turned in the dream into a wishful of now I can go on sleeping , okay there 's a bell , but it 's Sunday morning , you know , the bells are ringing , the church bells are ringing , I can go on sleeping , so they went on sleeping and they were late for the exam .	1.4213162483270334	True
1486	Six foot high and floodlit , they winked , mewed and yapped when the door bell was rung .	1.3758788350012923	True
1487	The prisoner who died in May [ ibid. ] was José Manuel Sevillano Martín , who had been sentenced to 24 years ' imprisonment in 1986 on a number of charges including robbery with menaces , membership of an illegal armed group and illegal possession of arms .	1.3512980700085224	True
1488	The Governor licked his lips again .	1.8599206650659932	True
1489	The global success of football has almost certainly sown the seeds for the game 's corruption .	1.3286643778892953	True
1490	Does n't ring a bell .	1.4151485234586818	True
