	Sentence	Unsupervised Metric	Classification
2604	In each case a different meaning is attached to the act of lighting a candle .	0.7691650552096894	True
2605	The two men were remanded in custody for a week .	1.7428576553975914	True
2606	There ca n't be a man alive who sees you and does n't want to take you to bed , who does n't wonder what you 're like , although some might be able to resist the temptation to try and find out once they realise what you are .	1.3150105537702452	True
2607	He is working on a scheme with the National Federation of WI to organise a competition to celebrate next year 's 75th anniversary by offering 10 telecottages as prizes for its 9,000 branches and he is hoping the WI will establish a pilot telecottage near its college in Denman , Oxfordshire .	1.1418048136576318	True
2608	4 : Research Grant	1.389558234923392	True
2609	she burst into tears .	1.7884382533540057	True
2610	His white teeth bit into his lower lip , and he appeared to be considering his reply .	1.765487631010549	True
2611	The heads of government of Austria , Finland , Iceland , Norway , Sweden and Switzerland — the six member countries of the European Free Trade Association ( EFTA ) — met in Gothenburg ( Sweden ) on June 14 to celebrate the 30th anniversary of the organization 's formation .	1.197082447255052	True
2612	They made no plea and were remanded in custody for seven days .	1.7108001716446153	True
2613	Parr , in grey slacks and sports jacket , kissed her on the cheek and came into the kitchen .	1.1429074890387678	True
2614	I quite like this bunny , he ca n't lick his lips .	1.8240332333829747	True
2615	She squints at Rainbow , purses her lips and shakes her head .	2.6279866161748453	True
2616	"Jim jumped up and down and kissed me noisily on the cheek , shouting : "" A goldmine , that 's what she is — a proper bloody goldmine ! """	1.0765777743980558	True
2617	Ruth gritted her teeth .	2.529768419516244	True
2618	I ring at a plastic bell and hear an electronic chime .	1.4374310385485891	True
2619	Thank goodness we did n't .	1.7024683298995036	True
2620	She was smiling and her whole face shone as if candles had been lit inside her .	0.7520197734397378	True
2621	He shrugged his broad shoulders and gave her a warm smile .	2.307222034281133	True
2622	Thank goodness for my spare tyre , I can afford to lose a bit of that .	1.7194254785735157	True
2623	He went and got his overcoat and put it on over his pyjamas and sat at the table smoking a cigarette .	1.0369821590582882	True
2624	‘ Thank goodness you 've come , officer .	1.762308661094374	True
2625	The value of Imagining Women lies precisely in its ability to bridge the gaps between the different areas of feminist practice and criticism in literature , the visual arts , performance , film and media .	1.292084523649804	True
2626	‘ I held it and it was biting my lip and kissing my face … ‘	1.644246743977353	True
2627	The air was still enough for candles to be lit .	0.7528165955030143	True
2628	Rory had been reduced to simply shrugging her shoulders in reply , stuck for an answer , and that had depressed her still more .	2.2536198070969733	True
2629	Research Grant ( Project )	1.337881769709389	True
2630	Gesner shrugged his shoulders .	2.351781476941158	True
2631	Louise , gritting her teeth against saying everything she wanted to say , spent part of the time making tea in the terrible little lean-to .	2.4485427333806165	True
2632	Hilda shrugged her shoulders .	2.359001060275897	True
2633	Even today , most convicts are sentenced to ‘ rigorous ’ imprisonment , and , although some revisions are currently being made , the gaols in most states are run according to manuals dating from the nineteenth century .	1.3706285378225405	True
2634	But Mr Mellor replied said that ‘ thank goodness in this free society ’ it was not part of his job to decide whether prosecuting authorities should prosecute .	1.7171209668621008	True
2635	I 've burst into tears .	1.8157103337054168	True
2636	I barely had time to notice that Masha was wearing Circassian trousers before she was in my arms , kissing my cheeks ; and Surkov was pumping my hand warmly .	1.0526481393172191	True
2637	He was a real pest , and thank goodness he and Great-Aunt Jane had no children .	1.6632832043429207	True
2638	DO N'T forget that you are warmly invited by the Warden to join with other fellow former students to celebrate the 30th Anniversary of the Hall 's opening on July 4th , 1992 .	1.0496784110449475	True
2639	With very fine seed try mixing it with fine silver sand to ensure the seeds are not sown too closely .	1.2567027981818095	True
2640	I do n't think there 's a style of voice , thank goodness .	1.6757026722226707	True
2641	that the sufferings , the sacrifices , the sorrow of the war have sown a seed from which a strong tree will grow .	1.2651825253437046	True
2642	Bending down , he kissed her gently on the cheek , leaving her staring after him .	1.1156903827517195	True
2643	My friend was most unimpressed , he had seen the footprints but shrugged his shoulders and suggested that we move on .	2.232256811207702	True
2644	Then I lay upon my understanding bed and burst into tears .	1.7827017356241526	True
2645	All the same it is hard to resist the temptation to describe United 's style as Wimbledon Mk II .	1.2857346636715856	True
2646	There is a Waverley Abbey connection here ; the piece was created in response to a commission from the Abbey of Cîteaux in France , the very first of the Cistercian monasteries , in order to celebrate the 900th anniversary of the birth of this remarkable man .	1.1191586210669264	True
2647	She drew in her breath sharply and bit down hard on her bottom lip in an effort not to cry out .	1.7320688165064766	True
2648	‘ Rastani could have rung the bell . ’	1.4180732575164439	True
2649	Gritted our teeth and made it through the weekend .	2.4764087410679023	True
2650	This is the time to sow biennial flower seeds , to flower next spring and early summer .	1.2713575255844551	True
2651	Felicity shrugged her shoulders .	2.3503394482296285	True
2652	The cornerstone of the Queen 's Speech will be a Bill to ratify the Maastricht Treaty that he negotiated last December .	1.2830946638111163	True
2653	He shrugged broad shoulders .	2.3587403825866513	True
2654	I resisted the temptation to read more .	1.326790575243431	True
2655	Thank goodness he has Cora-Beth to comfort him .	1.6810660138665312	True
2656	As the People 's Republic of China celebrated its thirty-fifth anniversary in 1984 , the prospects for continued agricultural improvement looked good .	1.0770781565942857	True
2657	Changes in auditing practices might be needed to bridge an ‘ expectations gap ’ about the role of auditors .	1.230810084546853	True
2658	The juxtaposition of those two words , ‘ family ’ and ‘ Corsica ’ , rang serious alarm bells in Preston 's mind .	1.3987914660337466	True
2659	Twenty four year old Darren Gale from Worcester was remanded in custody for seven days .	1.7338112418827243	True
2660	A further example is the registration of either a notice or a caution to give priority to a charge and bridge the gap between its creation and registration .	1.2441829563719566	True
2661	He shook Mandy , who burst into tears .	1.785064897277092	True
2662	Nicandra burst into tears and , as she opened her mouth for a bellow , the stored spinach and saliva shot out , into her plate , on to the tablecloth , a horrid defilement .	1.6917912705215143	True
2663	Mr James Bowen , the televisionist , has been celebrating the tenth anniversary of his ‘ television ’ contest , Bullseye , an adversarial entertainment based on the art of projectile throwing .	1.1518915363283657	True
2664	She bit her lip .	1.8188305870709796	True
2665	The whole room , scented with the Christmas goose , seemed to glimmer with warmth and merriment and if it had not been for fear of distressing the children , Alexandra would have been happy to burst into tears .	1.7446033484256445	True
2666	Both boys burst into tears , but it was eight-year-old Matthew who took the news the hardest .	1.7557442937130836	True
2667	‘ Thank goodness we have n't got H.B. any more , ’ whispered Enid .	1.660549737454629	True
2668	Michel Gbagbo , son of the IPF leader , and 44 others were sentenced to one year 's imprisonment .	1.4454593680199763	True
2669	She was about to turn and go back when she saw something that made her stop and purse her lips disapprovingly .	2.672996542210675	True
2670	"Chen Wan-chen , founder of the pro-independence Organization for Taiwan Nation-Building , was sentenced to 46 months ' imprisonment on March 16 after being found guilty of "" preparing to commit sedition "" under the controversial Article 100 of the Criminal Code [ see p. 38765 for Chen 's arrest in February ] ."	1.3683824333804466	True
2671	Oh I beg your pardon the deposit cheque .	2.316865659433022	True
2672	Research Grant ( Project )	1.337881769709389	True
2673	He knows it , and drives off into the night licking his dollar lips .	1.9192119051124283	True
2674	Research Grant ( Project )	1.5390556231590242	True
2675	Thank goodness for that , Maggie thought .	1.7404230179127658	True
2676	There was no application for bail and Rymer was remanded in custody until June 18 .	1.6847990845251404	True
2677	Obviously their kiss had been a mistake and a fiasco from the start , and her own wariness about her naïve feelings for him had rung warning bells in her mind since his first mention of a ‘ private nursing job ’ .	1.4478295498497347	True
2678	but she saw him on the way to work in town , had a bloody great barney with him on the market place on the way to work , just say , she was in there about ten minutes and burst into tears	1.7504104854548812	True
2679	Research Grant ( Project )	1.337881769709389	True
2680	Ringing the Pancake Bell at all 4 corners of the parish church is a tradition dating back 300 years .	1.3415001184249826	True
2681	She shrugged her shoulders .	2.3409355724514698	True
2682	Lady Dawn Kennedy , 31 , was remanded in custody accused of falsely claiming she had been raped by three men .	1.7048250885361378	True
2683	He was remanded in custody yesterday .	1.7158205843740102	True
2684	Well he was talking , he burst into tears .	1.7560903264400611	True
2685	bursting into tears .	1.8222710348680184	True
2686	Beg your pardon ?	2.3750628496773247	True
2687	Sow seed in gentle heat early May and plant out early June .	1.2138525137250589	True
2688	Her gaze lost focus and she licked her lips in an unpleasantly reptilian way .	1.8151045266620045	True
2689	David had lit two squat candles stuck in pottery sticks , and they provided the only light in the room .	0.7191151534916694	True
2690	Proksch was sentenced to 20 years ' imprisonment for the murders and for attempted fraud , the ship having been loaded with scrap metal but insured as carrying uranium-processing equipment valued at US$15,000,000 .	1.370028802336007	True
2691	First of all , because it is the capital ; Paris did n't want it and in London it would have been at Canary Wharf , which as you know is now in receivership , so thank goodness it did n't go there , and the Getty Museum is also restricted for visitors .	1.7010794510671803	True
2692	Lambert stared at him , licking his lips .	1.8143763347161905	True
2693	Although it is tempting to suggest that analogous neurons are involved in the orientation discrimination of bees , this temptation should be resisted — at least for the time being .	1.2422074959928173	True
2694	Freddie gritted his teeth in agitation .	2.4670681084531405	True
2695	All the hits are here ; ‘ Respect ’ , ‘ Musical Freedom ’ , ‘ Ring My Bell ’ , ‘ Warning ’ etc , but this is n't what it might have been .	1.3677510450060062	True
2696	I beg your pardon ?	2.3333054979607177	True
2697	A moment or two later he was ringing her door bell .	1.3692436699084292	True
2698	Lenny McLean was remanded in custody in London 's newest prison , Belmarsh in Woolwich .	1.6670011177408204	True
2699	She licked her lips .	1.964833954518957	True
2700	At his trial for acting with Waddell in the murder of Mrs Chipperfield , Gentle was found guilty and sentenced to life imprisonment .	1.3813363731132529	True
2701	Malc 's Mom held a small reception for us , doing the catering herself ( potted meat sandwiches with the crusts cut off ) and paid for a four-day honeymoon in Blackpool , where the landlady would sell us contraceptives — I was n't showing , and pride forced us to put on an act — but said we were too young to smoke and refused us cigarettes .	0.9922545154581388	True
2702	You will be aware that last year the IBOA celebrated the 75th Anniversary of its establishment in 1917 .	1.048991713019725	True
2703	We grope our way to the back door and up the stairs , lit by a single spluttering candle and tumble drunkenly into bed .	0.7852671987451596	True
2704	She buried her face against the pillows , biting hard into her lower lip to keep from begging .	1.6592860668095992	True
2705	To her dismay Sam burst into tears .	1.80394674115365	True
2706	In the course of the sequestration proceedings in the sheriff court he was sentenced to 30 days ' imprisonment for contempt of court , because he had entered the licensed premises and interfered with the management thereof after giving an undertaking that he would not do so .	1.3358214216751776	True
2707	Research Grant ( Project )	1.337881769709389	True
2708	They kissed Edouard on both cheeks , they patted him on the back , they looked at Isobel hard and long , and they seemed to approve of what they saw .	1.0966527852807608	True
2709	Both Mr. Workman and Miss Davies deposed to the fact that Mr. Whitehead , Mr. Bell 's solicitor , accepted that the matter could properly be adjourned until Monday , 19 February and that Mr. Whitehead did not object to his client being remanded in custody until that date .	1.6602941328247962	True
2710	Research Grant ( Project )	1.337881769709389	True
2711	Bella always tries , but after a few minutes she burst into tears and would never go near that room again .	1.7437732470269944	True
2712	I mean , ugh ? ’ he shrugs his shoulders and waves his beer and makes a geeky face .	2.2181865075304197	True
2713	Sidacai pursed his lips .	2.6811852539439065	True
2714	Poor Kitty , everyone said , when she did not conceive again ; thank goodness there 's a lesser Bainbridge to carry on the line .	1.7287491887385213	True
2715	She bit her lip .	1.7669588500289795	True
2716	He was cleared of wounding two other youths , but convicted of affray and was remanded in custody to be sentenced today .	1.6618702418194655	True
2717	pursed his lips and shook his head sympathetically .	2.625804726068073	True
2718	4 : Research Grant	1.5985277970323317	True
2719	The Scots did not initially resist ; they ratified the Treaties of Greenwich , at Holyrood Abbey on 25 August .	1.3321892035255878	True
2720	He does indeed go to great lengths to check the credentials of everything on sale at his deli-cum-restaurant-cum off-licence in Berkhamsted , Herts , ( ‘ Berko ’ to the locals ) celebrating its 10th anniversary this month .	1.1281731933061248	True
2721	His book Twilight over England , cites the case of a Jewish student who burst into tears when he discovered that he was only the second best and not the best in the list of those who had passed their medical exams .	1.7794743262686756	True
2722	‘ I went to church , ’ said Constance , ‘ to light a candle for my intentions . ’	0.8361599182693076	True
2723	Jimmy looked enquiringly at him and Pete just shrugged his shoulders .	2.268362229265939	True
2724	However , he bent down and kissed his little granddaughter on the cheek .	1.101232407704864	True
2725	When Mother — the marvellous Avis Bunnage , resisting all temptation to caricature — calls him down to breakfast , Crawford descends from the flies in a parachute .	1.3176929839375922	True
2726	He could ring the bell when he could descend no further .	1.3879068406487625	True
2727	Research Grant ( Project )	1.337881769709389	True
2728	Article 18 imposes an obligation on a State which has signed but not yet ratified a treaty , or which has ratified a convention prior to its entry into force , not to act so as to defeat the objects and purposes of the convention .	1.2421813645021547	True
2729	All I can do , Father Poole thought despairingly , is to try and give him the spiritual strength to resist such a temptation .	1.3100026086346461	True
2730	One evening our stepfather was smoking his strong Indian cigarettes in his room .	1.110227596310232	True
2731	And then anger took its place , and she moved sharply across to her bed and rang the bell .	1.3804419109467356	True
2732	Jim gritted his teeth .	2.4877879173237964	True
2733	She licked her parched lips , feeling her breath coming in laboured little spurts as the blood eddied along her veins , consuming her with a heady passion .	1.8165884653122073	True
2734	Paul bit his lip as he jogged at his father 's shoulder along a trail that wound through fringes of jungle beside the La Nga River .	1.7356481165100224	True
2735	A lawyer whose client committed murder while on bail says he 's opposed to a new law which could lead to more people being remanded in custody .	1.6524702873693136	True
2736	A man of 25 and a 15-year-old boy have been remanded in custody , charged with murdering Sgt Forth .	1.6448447801849433	True
2737	Thank goodness .	1.812492710024498	True
2738	Research Grant ( Project )	1.5390556231590242	True
2739	As she bit her lip , Desmond recognised her pain , and reached out sympathetically to touch her hand .	1.656852106333935	True
2740	I went round to his flat at about 8.30 , and there was a nice smell of roasting meat and candles on the table which were lit even though it was n't yet dark , and a bowl of those Indian bits and pieces for beforehand , and flowers on the coffee table .	0.7307248644661565	True
2741	Matthew burst into tears and ran out of the restaurant .	1.7598464979017931	True
2742	In a trial held in October 1990 , 38 members of the National United Front for the Liberation of Vietnam ( NUFLVN ) resistance movement were sentenced to long terms of imprisonment after being found guilty of attempting to overthrow the government .	1.3637666923719935	True
2743	No we 're gon na light the candles in	0.8134967448866965	True
2744	Holding out her hand , her smile wide , she said , ‘ It 's good to see you home again , Martin , ’ and his answer was to take her hand and kiss her on the cheek and say , ‘ It 's good to be home , Aunt .	1.0721461122880165	True
2745	Well I remember Jackie telling me , she came back from sh she came up to meet me in London one day and she came up with the woman , a German woman , who at that time was a buyer for Army and Navy er women 's fashions and this woman said that the model girls who are so thin she said they 're always bursting into tears and crying because they 're under such stress to keep their weight down and their boyfriends do n't like it because the girls are are lovely to have on their arms to take out , you know everybody sort of goggles , you know , lovely slim girl with yellow half way down her back etc. but , in fact , these girls get very , very ratty !	1.8737947753312763	True
2746	We hope that the republics will be willing to ratify the treaty and implement its terms .	1.280033644055329	True
2747	Five two three , I beg your pardon .	2.337869790241762	True
2748	In the cold light that streamed through the small window across his face , she saw his half-open eyes , his tongue licking dry lips , and heard the quick harsh breathing .	1.8635822250906442	True
2749	Gritting her teeth , she got up and stood looking around .	2.4484025228834234	True
2750	The whole plastic notion of a pop star begins to ring the bells of truth .	1.3890542016009206	True
2751	Charles resisted the temptation to give Miles ' address , funny though the image of his son-in-law being blackmailed with dirty photographs was .	1.3004503174551847	True
2752	Graham Slim and Keith Hastings ; both from Birmingham were remanded in custody .	1.74836522681724	True
2753	Research Grant ( Personal )	1.3641965240108336	True
2754	Also on Oct. 5 Nay Minh , a prominent lawyer , was sentenced to 14 years ' imprisonment for allegedly giving false information to the British Broadcasting Corporation ( BBC ) during the 1988 uprising [ for arrests in November 1988 see p. 36868 ] .	1.3820075239741278	True
2755	In 1991 the Philippines ' Senate had refused to ratify a renegotiated bases treaty , and the US military had been given until the end of 1992 to effect a complete withdrawal .	1.29490383664431	True
2756	The Harlequin man pursed his lips and sucked in his cheeks not in a cadaverous but in a speculative , mischievous style which nevertheless bespoke some fatal intent .	2.6622854061030905	True
2757	Recollecting , she bit her lip .	1.8048862662354421	True
2758	I choked up and , big daft girl 's blouse that I am , burst into tears .	1.7719400552640012	True
2759	I beg her pardon	2.3603097911443447	True
2760	ORGANISERS of the Northern Bank Primary mini-rugby tournament are looking for ‘ forgotten ’ players to help them celebrate the 21st anniversary of the Ravenhill finals on June 19 .	1.0974606864413594	True
2761	Research Grant ( Project )	1.337881769709389	True
2762	Oh beg your pardon sorry I did n't realise	2.263635591407543	True
2763	"The UK government formally notified the German government on Nov. 9 that it had ratified the "" two-plus-four "" Treaty on the Final Settlement with respect to Germany , which had been signed on Sept. 12 by the two Germanies , France , the Soviet Union , the United Kingdom and the United States [ see pp. 37717-18 ; for text see p. 37834 ] ."	1.2612586271782378	True
2764	Good night , my — ’ He stopped , bit his lip , and turned quickly away .	1.7363129373456623	True
2765	Er , not the Old Vic , I beg your pardon , the Young Vic .	2.2557904438511214	True
2766	The judge , Mr Justice Laws , refused to renew bail and remanded them in custody to await sentence after social inquiry reports .	1.6089255142243035	True
2767	It 's a good idea to be clear on this at the outset ; it 's also a good idea to resist the temptation to start shooting whatever catches your eye the moment you arrive .	1.286236011628447	True
2768	THREE men arrested after the IRA bombing of a Warrington gas works and shooting of a police officer were today further remanded in custody until April 22 at London 's Arbour Square Magistrates Court .	1.6170634052982154	True
2769	BELVOIR IBC are holding an ‘ Open Day ’ on Monday ( 7-30pm ) to celebrate its 20th Anniversary Season .	1.0813578977763298	True
2770	‘ I beg your pardon ? ’ asked the Widow Phipps .	2.241911389634907	True
2771	The submaximal plateau lasted for three hours , and half way through this the subject smoked one cigarette at the usual rate .	1.0277426300253556	True
2772	He shifted in his chair , biting his lip .	1.7798695220568712	True
2773	NEVER TOO LATE TO STOP SMOKING The average cigarette shortens life by seven minutes , and smoking takes six years off the average life .	1.0246460596137297	True
2774	She lit a candle over there as a silent prayer for her estranged husband and went home .	0.7772079221112225	True
2775	Besides Djohar and Taki , the six other candidates were : ( i ) Prince Said Ali Kemal , a former ambassador , the grandson of the last Sultan of the islands and founder of the Chuma ( Islands ' Friendship and Unity ) Party ; ( ii ) Mohamed Ali Mroudjae , a former Prime Minister , of the Parti comorien pour la démocratie et le progrès ; ( iii ) Mohammed Hassan Ali , a former Vice-President , now leader of the Moheli National Front ; ( iv ) Abbas Djoussouf , representing the Mouvement démocratique populaire ; ( v ) Mohammed Ali Mbalya of the Parti socialiste des Comores ; and ( vi ) Moustapha Said Cheikh , a Marxist standing for the Front démocratique , who had been sentenced to life imprisonment for his part in an attempted coup in 1985 , but who had been released from prison following Abdallah 's death .	1.4997165238749182	True
2776	She pursed her lips .	2.677336063933391	True
2777	He bit lightly at her lower lip .	1.7596790606746096	True
2778	It 's downhill here on in thank goodness .	1.7894409285295898	True
2779	Anyway , one day at a time : tomorrow I go to Durham and , as Mother said ’ — she pursed her lips now — ‘ it will give me an opportunity to wear some of the clothes I have been spending my money on .	2.7119604616362554	True
2780	Water the containers and allow to drain , then sow the seed thinly over the surface .	1.2649894390070142	True
2781	The partners should resist the temptation to give their reasons for deciding to exercise the power .	1.2579188718787762	True
2782	4 : Research Grant	1.5985277970323317	True
2783	He was remanded in custody .	1.7327080870772125	True
2784	When you are ready , ring the service bell and one of the maids will show you to it . ’	1.3477974042034855	True
2785	If the checklist is to be used as a basis for intervention , large ‘ developmental gaps ’ between items will require that the teacher or therapist is able to devise suitable intermediate objectives to bridge the gap between items .	1.2745102035945615	True
2786	He denied the Government would ignore Parliament by ratifying the treaty using the royal prerogative .	1.2967212386741434	True
2787	Hon W.L. MacKenzie King , Prime Minister of Canada , admitted shyly to Edna Jacques that he had been an ardent fan for over 20 years , and Mrs Nellie McClung , the Canadian novelist , said to her ‘ You have the gift , Edna dear , to ring bells in the hearts of the people ’ .	1.4859412785173514	True
2788	The Vice-Admiral lived at the back , and he opened his front door a few seconds after Pooley rang the bell .	1.3416737395260248	True
